1,2025-04-28,경상북도,성주군,"성주군, 교통사고예방 결의대회 및 교통안전체험 한마당 성료",한국교통장애인협회 성주군지회(지회장 이인구)는 지난 24일 별의별문화마당에서 200여명이 참석한 가운데 '2025년 성주군 교통사고예방 결의대회 및 제4회 교통안전체험 한마당'행사를 개최했다. 이번 행사는 '음주운전... ,http://www.newsprime.co.kr/news/article.html?no=686072,,음주
2,2025-04-28,경상북도,성주군,교통사고예방 결의대회 및 교통안전체험한마당,"지난 24일 별의별문화마당에서 200여명의 내빈이 참석한 가운데 성주군 교통사고예방 결의대회 및 제4회 교통안전체험 한마당이 열렸다. 한국교통장애인협회 성주군지회는 ‘음주운전, 안전띠 미착용, 졸음운전 교통 3악... ",http://www.seongjuro.co.kr/news/view.php?idx=57170,,음주
3,2025-04-28,부산시,동구,"60대 음주운전자가 몰던 승용차, 택시 2대와 잇따라 충돌…5명 부상",27일 오후 10시5분께 교통사고가 발생한 부산 동구 좌천동 가구거리 앞 도로 [사진=부산동부경찰서] 2025.04.28 이 사고로 택시운전자 2명과 탑승객 3명이 다쳤으나 생명에는 지장이 없는 것으로 확인됐다. 경찰은 사고... ,https://www.newspim.com/news/view/20250428000705,,음주
4,2025-04-28,부산시,동구,부산 동구 좌천동 가구거리 앞 도로 음주 교통사고,"4월 27일 오후 10시 5분경 부산 동구 좌천동 가구거리 앞 도로(좌천삼거리-&gt;범곡교차로 방면)에서 음주운전 교통사고가 발생했다. A씨(60대·남)운전의 승용차량이 직진 운행 중, 전방에 신호대기 중이던 택시 2대를... ",http://www.lawissue.co.kr/view.php?ud=202504281342325999a8c8bf58f_12,,음주
5,2025-04-28,인천시,연수구,"인천시 연수구, 국토교통부 주관 ‘교통문화지수’ 전국 1위 달성","조사항목의 18개 세부 평가지표를 살펴보면, 연수구는 교통사고 사상자 안전 부문에서 자치구 1위로 높게 평가됐으며, 교통안전 전문성 및 예산확보, 교통안전 정책 이행 등의 행정 노력 항목과 음주운전금지 준수율... ",https://www.siminilbo.co.kr/news/newsview.php?ncode=1160290412982835,,음주
6,2025-04-27,부산시,사상구,"한쪽은 신호위반, 한쪽은 음주운전…교통사고에 20대 사망","부산 사상구 감전동 도로에서 발생한 교통사고 현장. 불법 좌회전과 음주운전이 겹치며 충돌한 사고로, 소방대원과 경찰이 수습에 나섰고 사고 차량 두 대가 심하게 파손된 채 도로에 멈춰 서 있다. 부산사상경찰서 불법... ",https://n.news.naver.com/mnews/article/021/0002705871?sid=102,,음주
7,2025-04-27,부산시,동구,&quot;동구 버스노선 환승·배차간격 불편 의견 유연한 검토를&quot;,또 천상고 학부모들과 학교 관계자들은 &quot;과속방지턱과 단속카메라가 없어 등·하교하는 학생들이 사고 위험에 노출돼 있다&quot;며 &quot;고등학교라 어린이보호구역이 아니고 경사가 있는 제한속도 50㎞/h 도로라서 교통사고 우려가... ,http://www.ujeil.com/news/articleView.html?idxno=366163,,과속
8,2025-04-27,부산시,사상구,신호위반 차량과 음주운전 차량 충돌…1명 사망·4명 부상,▲ 교통사고 현장 부산에서 신호 위반 차량과 음주운전 차량이 부딪혀 1명이 숨지고 4명이 다치는 사고가 일어났습니다. 오늘(27일) 새벽 0시쯤 부산 사상구 감전동의 한 도로에서 좌회전하던 승용차가 맞은편에서... ,https://n.news.naver.com/mnews/article/055/0001252996?sid=102,,음주
9,2025-04-27,부산시,사상구,부산 사상구 감전동서 교통사망사고,"A씨(30대·남, 경상, 음주해당 없음)운전의 1)차량이 직진 신호임에도 신호를 위반해 좌회전하던 중, 반대 차로에서 직진신호에 직진하는 B씨(20대·남, 경상, 음주)운전의 2)차량과 충돌한 교통사고가 발생했다. 이... ",http://www.lawissue.co.kr/view.php?ud=2025042711512455039a8c8bf58f_12,,음주
10,2025-04-26,경상북도,칠곡군,"칠곡서, 끈질긴 추적수사 끝에 상습음주운전자 구속",A씨는 지난 3월 칠곡군 북삼읍 일대에서 혈중알콜농도 0.285% 만취상태로 음주운전을 하다 주차 중인 다른 차량을 충돌하는 교통사고를 낸 혐의를 받고 있다. 경찰은 도주한 A씨가 도피자금 마련을 위해 지인을 찾아간... ,http://www.kbsm.net/news/view.php?idx=472909,,음주
11,2025-04-26,인천시,연수구,"인천 연수구, 국토교통부 주관 '교통문화지수' 전국 1위","조사항목의 18개 세부 평가지표를 살펴보면, 연수구는 교통사고 사상자 안전 부문에서 자치구 1위로 높게 평가됐으며, 교통안전 전문성 및 예산확보, 교통안전 정책 이행 등의 행정 노력 항목과 음주운전금지 준수율... ",http://www.hansbiz.co.kr/news/articleView.html?idxno=746351,,음주
12,2025-04-25,제주도,서귀포시,제주 서귀포 음주단속에… 숙취 운전자들 줄줄이 적발,이어 &quot;교통 사망사고 예방과 음주운전 근절을 위해 시간과 장소를 가리지 않고 지속 단속할 것이다&quot;라며 &quot;특히 황금연휴를 앞두고 교통사고 예방과 성숙한 교통 문화가 정착된 서귀포시를 만들겠다&quot;라고 전했다.,https://www.mediajeju.com/news/articleView.html?idxno=357836,,음주
13,2025-04-25,서울시,강남구,"반성문 100장 소용無, 김호중 항소심도 징역 2년6개월 실형 [종합]",또 김 씨의 교통사고와 도주 부분 죄질이 불량하고 범행 후 정황도 좋지 않다&quot;고 양형의 이유를 설명했다. 김호중은 지난해 5월 9일 서울 강남구 압구정동의 한 도로에서 음주 상태로 사고를 낸 뒤 현장에서 도주하고... ,https://m.entertain.naver.com/article/408/0000263382,,음주
14,2025-04-25,경상북도,김천시,"‘음주 뺑소니’ 김호중 2심서도 실형…김천시, ‘김호중 소리길’ 철거...","서울중앙지법 형사항소5-3부(김지선 소병진 김용중 부장판사)는 25일 특정범죄 가중처벌법상 위험운전치상·도주치상, 도로교통법상 사고 후 미조치 혐의로 구속기소 된 김씨에게 1심과 마찬가지로 징역 2년 6개월을... ",https://n.news.naver.com/mnews/article/081/0003536663?sid=102,,음주
15,2025-04-25,서울시,서초구,반성문 130장 안통했다…김호중 2심도 징역 2년6개월,음주 상태로 교통사고를 낸 후 도주한 혐의로 1심에서 실형을 선고받은 트로트 가수 김호중(34)씨가 항소심에서도 실형을 선고받았다. 음주 뺑소니 혐의를 받고 있는 트로트 가수 김호중이 지난해 5월 24일 서울 서초구... ,https://n.news.naver.com/mnews/article/018/0005997470?sid=102,,음주
16,2025-04-25,서울시,강남구,"&quot;음주량 상당했다&quot;…김호중, 뺑소니 사건 2심도 실형→징역 2년6개월",트로트 가수 김호중은 음주 상태에서 교통사고를 내고 도주한 뒤 경찰에 자진 출석한 혐의 등으로 1심에서 징역 2년 6개월을 선고받았다. 김호중은 지난 2023년 5월 9일 오후 11시 40분쯤 서울 강남구 압구정동 한 도로에서... ,https://www.topstarnews.net/news/articleView.html?idxno=15648502,,음주
17,2025-04-25,강원도,양구군,&quot;교통안전 위협하는 과속방지턱…전면 재정비 필요&quot;,"김정미 양구군의원은 25일 본회의 7분 자유발언을 통해, 과속방지턱의 과잉 설치와 관리 부실이 교통사고 위험과 주민 불편을 초래하고 있다며 전면적인 실태조사와 정비를 촉구했다. 김 의원은 &quot;과속방지턱은 교통사고... ",https://n.news.naver.com/mnews/article/654/0000118172?sid=102,,과속
18,2025-04-25,제주도,서귀포시,"서귀포경찰서 아침 불시 음주단속, 잇따라 적발",김용태 서귀포경찰서장은 &quot;교통 사망사고 예방과 음주 운전 근절 등을 위해 시간과 장소를 가리지 않고 지속적인 단속에 나설 것&quot;이라며 &quot;성숙한 교통 문화를 정착시켜 안전한 서귀포시를 만들어 나가겠다&quot;고 강조했다.,https://www.newsjeju.net/news/articleView.html?idxno=409900,,음주
19,2025-04-25,충청남도,논산시,서승필 논산시의원 &quot;냉·온열 의자 확대·장수의자 설치 등 교통복지 실...,그는 &quot;신호 대기 중 무릎과 허리 통증으로 경계석에 앉거나 무단횡단하는 고령자들이 많다&quot;며 &quot;이는 교통사고의 주요 원인이 되고 있다&quot;고 설명했다. 한국교통안전공단 통계에 따르면 전체 보행 사망자 중 62.1%가... ,https://n.news.naver.com/mnews/article/629/0000385129?sid=102,,무단횡단
20,2025-04-25,경상북도,칠곡군,"칠곡경찰서, 끈질긴 추적 수사…상습음주운전자 검거 구속",A 씨는 지난 3월 칠곡군 북삼읍 일대에서 혈중알콜농도 0.285% 만취 상태로 음주운전을 하다 주차 중인 다른 차량을 충돌하는 교통사고를 낸 혐의를 받고 있다. 경찰은 도주한 A 씨가 도피자금 마련을 위해 지인을 찾아간... ,http://www.m-i.kr/news/articleView.html?idxno=1232651,,음주
21,2025-04-24,경상북도,칠곡군,"음주운전 집유기간 중 또?…칠곡경찰, 끈질긴 추적 끝 상습음주운전자...",A씨는 지난달 칠곡군 북삼읍 일대에서 혈중알콜농도 0.285% 만취상태로 음주운전을 하다 주차 중인 다른 차량을 충돌하는 교통사고를 낸 혐의를 받고 있다. 경찰은 도주한 A씨가 도피자금 마련을 위해 지인을 찾아간... ,http://www.ksmnews.co.kr/news/view.php?idx=536966,,음주
22,2025-04-24,경상북도,칠곡군,"칠곡경찰서, 끈질긴 추적 끝 상습 음주운전자 검거·구속",A씨는 지난 3월 칠곡군 북삼읍 일대에서 혈중알콜농도 0.285% 만취상태로 음주운전을 하다 주차 중인 다른 차량을 충돌하는 교통사고를 낸 혐의를 받고 있다. 경찰은 도주한 A씨가 도피자금 마련을 위해 지인을 찾아간... ,http://www.hidomin.com/news/articleView.html?idxno=579119,,음주
23,2025-04-24,서울시,중구,"대구중부署, 등하굣길 음주단속 실시",대구 중부경찰서 제공 대구 중부경찰서는 스쿨 존 내 교통사고 위험요소 사전 제거를 위해 지난 23일 중구 남산초등학교 인근 스쿨존에서 음주단속을 실시했다. 중부경찰서 관계자는 &quot;어린이들에게 가장 안전해야 할 도로... ,https://www.idaegu.co.kr/news/articleView.html?idxno=507833,,음주
24,2025-04-24,경상북도,칠곡군,경북 칠곡경찰서…상습 음주운전자 50대 구속,경찰에 따르면 A씨는 지난 3월 칠곡군 북삼읍 일대에서 혈중알코올농도 0.285% 만취상태로 음주운전을 하다 주차 중인 다른 차량을 충돌하는 교통사고를 낸 혐의를 받고 있다. A씨는 소주 2병을 마시고 운전하다 사고를 낸... ,https://n.news.naver.com/mnews/article/088/0000944069?sid=102,,음주
25,2025-04-24,경상북도,성주군,"성주군, 교통사고예방 결의대회 및 제4회 교통안전체험 한마당 개최",한국교통장애인협회 성주군지회(지회장 이인구)는 24일 별의별문화마당에서 200여 명이 참석한 가운데 ‘2025년 성주군 교통사고예방 결의대회 및 제4회 교통안전체험 한마당’ 행사를 개최했다. 이번 행사는 ‘음주운전... ,https://www.nspna.com/news/?mode=view&newsid=752185,,음주
26,2025-04-24,경상남도,창원시,"창원시, '멈추고, 살피고, 건너자'교통안전 집중 홍보",이번 캠페인은 교통사고 예방을 위한 보행자와 운전자들의 경각심을 높이는 데 초점을 맞췄다. 주요 내용은 ▲도로 횡단전 주위 살피기 ▲ 무단횡단 하지 않기 ▲ 보행 중 스마트 기기 사용하지 않기 ▲ 횡단보도 정지선... ,https://www.newsgn.com/news/articleView.html?idxno=479152,,무단횡단
27,2025-04-24,인천시,연수구,"인천 연수구, '교통문화지수' 전국 1위 달성","조사항목 18개 세부 평가지표를 살펴보면 연수구는 교통사고 사상자 안전 부문에서 자치구 1위로 높게 평가됐고 교통안전 전문성과 예산확보, 교통안전 정책 이행 등 행정 노력 항목과 음주운전금지 준수율, 이륜차... ",https://news.ifm.kr/news/articleView.html?idxno=440948,,음주
28,2025-04-24,인천시,연수구,"연수구, '교통문화지수' 전국 1위...국토교통부 장관상 수상","조사항목의 18개 세부 평가지표를 살펴보면, 연수구는 교통사고 사상자 안전 부문에서 자치구 1위로 평가됐으며, 교통안전 전문성 및 예산확보, 교통안전 정책 이행 등의 행정 노력 항목과 음주운전금지 준수율 및... ",https://www.kmaeil.com/news/articleView.html?idxno=502748,,음주
29,2025-04-24,인천시,연수구,"연수구, 국토교통부 주관 교통문화지수 전국 1위 달성","조사항목의 18개 세부 평가지표를 살펴보면, 연수구는 교통사고 사상자 안전 부문에서 자치구 1위로 높게 평가됐다. 교통안전 전문성 및 예산확보, 교통안전 정책 이행 등의 행정 노력 항목과 음주운전금지 준수율... ",https://www.kgnews.co.kr/news/article.html?no=842025,,음주
30,2025-04-24,인천시,연수구,[24일 인천 연수구] 국토부 ‘교통문화지수’ 전국 1위 달성 등,"조사항목의 18개 세부 평가지표를 살펴보면, 연수구는 교통사고 사상자 안전 부문에서 자치구 1위로 높게 평가됐으며, 교통안전 전문성 및 예산확보, 교통안전 정책 이행 등의 행정 노력 항목과 음주운전금지 준수율... ",https://www.asiatime.co.kr/article/20250424500214,,음주
31,2025-04-24,인천시,연수구,"인천연수구, 국토교통부 주관 ‘교통문화지수’ 전국 1위 달성","조사항목의 18개 세부 평가지표를 살펴보면, 연수구는 교통사고 사상자 안전 부문에서 자치구 1위로 높게 평가됐으며, 교통안전 전문성 및 예산확보, 교통안전 정책 이행 등의 행정 노력 항목과 음주운전금지 준수율... ",http://www.globalepic.co.kr/view.php?ud=2025042410402449006e1e092a28_29,,음주
32,2025-04-28,경기도,용인시,용인 경부고속도로 음주운전 SUV 추돌…경찰 운전자 입건,소형승합차 전복 운전자 경상 병원 이송 면허 취소 수준 음주 경찰 수사 본격 착수 용인시 기흥구 경부고속도로에서 술에 취한 상태로 운전대를 잡은 20대가 다른 차량과 추돌하는 사고를 냈다. 28일 경찰은 A씨를... ,https://www.kgnews.co.kr/news/article.html?no=842620,,음주
33,2025-04-28,경상북도,성주군,"성주군, 교통사고예방 결의대회 및 교통안전체험 한마당 성료","이번 행사는 '음주운전, 안전띠 미착용, 졸음운전 교통 3악(惡)을 추방하자'란 구호 아래 유공자 표창 및 감사패 시상을 시작으로 대회사, 환영사, 치사, 축사, 교통안전 결의문 낭독 순으로 진행됐다. 결의대회에 이어... ",http://www.newsprime.co.kr/news/article.html?no=686072,,음주
34,2025-04-28,충청남도,예산군,&quot;쉬는데 시끄럽게!&quot;…음주운전해 초등생 쫓아가 혼낸 교사,충남 예산경찰서는 도로교통법상 음주운전과 폭행 혐의로 초등교사 A씨를 입건해 조사하고 있다고 오늘(28일) 밝혔습니다. A씨는 지난 26일 오후 5시 41분쯤 예산군 삽교읍 자신의 단독주택 앞에서 초등생 2명을 쫓기 위해... ,https://n.news.naver.com/mnews/article/422/0000735439?sid=102,,음주
35,2025-04-28,경상북도,성주군,교통사고예방 결의대회 및 교통안전체험한마당,"한국교통장애인협회 성주군지회는 ‘음주운전, 안전띠 미착용, 졸음운전 교통 3악(惡)을 추방하자’란 구호 아래 유공자 표창 및 감사패 시상을 시작으로 대회사, 환영사, 치사, 축사, 교통안전 결의문 낭독이 이어졌다.... ",http://www.seongjuro.co.kr/news/view.php?idx=57170,,음주
36,2025-04-28,충청남도,예산군,&quot;왜 집 앞에서 떠들어&quot;… 음주운전해 초등생 쫓아가 폭행한 교사,"28일 뉴스1에 따르면 충남 예산경찰서는 이날 초등학교 교사 40대 A씨를 폭행, 음주운전 등의 혐의로 불구속 입건했다. A씨는 지난 26일 오후 5시40분쯤 예산군 삽교읍에서 초등학생을 폭행한 혐의를 받고 있다. A씨는... ",https://n.news.naver.com/mnews/article/417/0001073848?sid=102,,음주
37,2025-04-28,충청남도,예산군,&quot;왜 집 앞에서 떠들어&quot;..음주운전해 초등생들 쫓아가 폭행한 교사,28일 충남 예산경찰서는 도로교통법상 음주운전 및 폭행 혐의로 초등교사 40대 A씨를 입건해 조사하고 있다고 밝혔다. A씨는 지난 26일 오후 5시 41분께 예산군 소재의 자신의 단독주택 인근에서 초등학생 2명을 쫓아가... ,https://n.news.naver.com/mnews/article/014/0005342337?sid=102,,음주
38,2025-04-28,충청남도,예산군,&quot;집 앞에서 왜 떠들어&quot;…음주운전으로 초등생들 쫓아가 때린 교사,"28일 충남 예산경찰서에 따르면 폭행, 음주운전 등 혐의로 초등학교 교사 A씨(40대)가 불구속 입건됐다. A씨는 이달 26일 오후 5시40분께 예산군 삽교읍에서 초등학생들을 때린 혐의를 받는다. A씨는 자신의 집 앞에서... ",https://n.news.naver.com/mnews/article/011/0004479296?sid=102,,음주
39,2025-04-28,충청남도,예산군,“쉬는데 떠들어” 음주 운전해 쫓아간 혼낸 초등교사,충남 예산경찰서는 28일 도로교통법상 음주운전 및 폭행 혐의로 초등교사 A씨를 입건해 조사하고 있다고 밝혔다. 경찰에 따르면 A씨는 지난 26일 오후 5시 41분쯤 충남 예산군 삽교읍 자신의 주택에서 약 100m를 음주... ,https://n.news.naver.com/mnews/article/081/0003537142?sid=102,,음주
40,2025-04-28,충청남도,예산군,'집앞서 떠들었다고...' 음주운전해 쫓아가 혼낸 초등교사 검거,충남 예산경찰서는 도로교통법상 음주운전 및 폭행 혐의로 초등교사 A(40대)씨를 입건해 조사하고 있다고 28일 밝혔습니다. A씨는 지난 26일 오후 5시 41분께 예산군 삽교읍 자신의 단독주택에서 도망가는 초등생 2명을... ,https://www.tjb.co.kr/news05/bodo/view/id/73968,,음주
41,2025-04-28,부산시,동구,부산 동구에서 음주운전으로 2중 추돌사고...경상 5명,지난 27일 부산 동구에서 음주운전자가 택시 2대를 연이어 들이받은 사고가 발생했다. 경찰은 이날 오후 10시 5분쯤 동구 좌천동 범곡교차로 방면에서 사고가 발생했다고 28일 밝혔다. 경찰에 따르면 승용차 운전자 A씨... ,https://www.pennmike.com/news/articleView.html?idxno=99431,,음주
42,2025-04-28,충청남도,예산군,'떠들고 도망친 초등생' 음주운전해 쫓아가 혼낸 초등교사 검거,충남 예산경찰서는 도로교통법상 음주운전 및 폭행 혐의로 초등교사 A(40대) 씨를 입건해 조사하고 있다고 오늘(28일) 밝혔습니다. A 씨는 지난 26일 오후 5시 41분 예산군 삽교읍 자신의 단독주택에서 도망가는 초등생... ,https://n.news.naver.com/mnews/article/055/0001253283?sid=102,,음주
43,2025-04-28,충청남도,예산군,'떠들고 도망친 초등생' 음주운전해 쫓아가 혼낸 초등교사 검거,충남 예산경찰서는 도로교통법상 음주운전 및 폭행 혐의로 초등교사 A(40대)씨를 입건해 조사하고 있다고 28일 밝혔다. A씨는 지난 26일 오후 5시 41분께 예산군 삽교읍 자신의 단독주택에서 도망가는 초등생 2명을 쫓기... ,https://n.news.naver.com/mnews/article/001/0015356748?sid=102,,음주
44,2025-04-28,충청남도,예산군,&quot;왜 떠들어&quot;…술 마신 채 차 몰고 초등생 쫓아간 초등교사,28일 충남 예산경찰서는 도로교통법상 음주운전 및 폭행 혐의로 초등교사 A씨(40대)를 입건해 조사하고 있다고 밝혔다. A씨는 지난 26일 오후 5시 40분쯤 예산군 삽교읍 자신의 단독주택 앞에서 떠드는 학생들에게 주의를... ,https://n.news.naver.com/mnews/article/025/0003437166?sid=102,,음주
45,2025-04-28,부산시,동구,"부산 동구에서 만취 운전 차량, 택시 2대 들이받아… 5명 경상",경찰 조사에서 A 씨의 혈중알코올농도는 면허 취소 수치에 해당하는 0.08%를 초과했다. 경찰은 A 씨를 도로교통법 위반(음주운전)으로 검거해 정확한 사고 경위 등을 조사하고 있다.,https://n.news.naver.com/mnews/article/082/0001323298?sid=102,,음주
46,2025-04-28,부산시,동구,면허 취소 수치로 운전…택시 2대 들이받은 60대 남성,부산 동부경찰서는 도로교통법상 음주운전 혐의로 60대 A씨를 입건해 조사하고 있다고 오늘(28일) 밝혔습니다. A씨는 어제(27일) 오후 10시 5분쯤 부산 동구에서 신호 대기 중이던 택시 2대를 뒤에서 들이받은 혐의를... ,https://n.news.naver.com/mnews/article/422/0000735408?sid=102,,음주
47,2025-04-28,부산시,동구,"60대 음주 운전자, 택시 2대 잇달아 들이받아…5명 부상",부산에서 음주운전자가 운행하던 승용차가 신호대기 중이던 택시 두대를 연이어 들이받은 사고가 일어났다. 28일 부산 동부경찰서에 따르면 지난 27일 오후 10시5분께 부산 동구 좌천동 가구거리 앞 도로에서 운전자 A... ,https://n.news.naver.com/mnews/article/658/0000105433?sid=102,,음주
48,2025-04-28,부산시,동구,부산서 60대 만취 운전자 신호대기 택시 2대 들이받아…5명 부상,부산 동부경찰서는 도로교통법(음주운전) 및 특정범죄가중처벌등에관한법률(위험운전치상) 위반 등의 혐의로 A(60대)씨를 불구속 입건해 조사 중이라고 28일 밝혔다. 경찰에 따르면 지난 27일 오후 10시5분께 동구의 한... ,https://n.news.naver.com/mnews/article/003/0013210531?sid=102,,음주
49,2025-04-28,부산시,동구,부산서 만취 운전 60대 택시 2대 잇달아 '쾅'…5명 부상,부산 동부경찰서는 도로교통법(음주운전) 위반 혐의로 60대 A 씨를 입건해 조사하고 있다고 28일 밝혔다. A 씨는 지난 27일 오후 10시5분께 부산 동구 좌천동 가구거리 앞 도로에서 신호 대기 중이던 택시 2대를 뒤에서... ,https://n.news.naver.com/mnews/article/421/0008219098?sid=102,,음주
50,2025-04-28,부산시,동구,택시 2대 들이받은 60대 음주 운전자…총 5명 부상,28일 부산 동부경찰서는 60대 A씨를 도로교통법상 음주운전 혐의로 입건해 조사하고 있다고 밝혔다. A씨는 전날 오후 10시 5분께 부산 동구에서 신호 대기 중이던 택시 2대를 뒤에서 들이받은 혐의를 받고 있다. 이... ,https://n.news.naver.com/mnews/article/015/0005124907?sid=102,,음주
51,2025-04-28,부산시,동구,부산 동구 좌천동 가구거리 앞 도로 음주 교통사고,"4월 27일 오후 10시 5분경 부산 동구 좌천동 가구거리 앞 도로(좌천삼거리-&gt;범곡교차로 방면)에서 음주운전 교통사고가 발생했다. A씨(60대·남)운전의 승용차량이 직진 운행 중, 전방에 신호대기 중이던 택시 2대를... ",http://www.lawissue.co.kr/view.php?ud=202504281342325999a8c8bf58f_12,,음주
52,2025-04-28,부산시,동구,"60대 음주 운전자, 택시 2대 잇달아 들이받아…5명 부상",부산 동부경찰서는 도로교통법상 음주운전 혐의로 60대 A씨를 입건해 조사하고 있다고 28일 밝혔다. A씨는 전날 오후 10시 5분께 부산 동구에서 신호 대기 중이던 택시 2대를 뒤에서 들이받은 혐의를 받고 있다. 이... ,https://n.news.naver.com/mnews/article/001/0015356581?sid=102,,음주
53,2025-04-28,충청남도,예산군,&quot;집 앞에서 떠들지 마&quot;…차 몰고 초등생들 쫓아가 때린 초등교사,"28일 뉴스1에 따르면 충남 예산경찰서는 폭행, 음주운전 등 혐의로 초등학교 교사 A씨(40대)를 불구속 입건했다. A씨는 지난 26일 오후 5시40분쯤 예산군 삽교읍에서 초등학생들을 때린 혐의를 받는다. A씨는 자신의 집... ",https://n.news.naver.com/mnews/article/008/0005186884?sid=102,,음주
54,2025-04-28,경기도,김포시,[제보23] 서울 서빙고역 인근서 화물차 추돌 사고…60대 숨져 外,▶ 음주의심 차량 쫓던 순찰차 펜스 '쾅'…경찰 3명 부상 어제(27일) 새벽 1시 40분쯤 음주운전 의심 차량을 추격하던 순찰차가 가로등과 펜스를 들이받았습니다. 김포경찰서에 따르면 김포시 양촌읍 도로에서 마산지구대... ,https://n.news.naver.com/mnews/article/422/0000735384?sid=102,,음주
55,2025-04-28,경기도,평택시,무면허 걸리자 ‘경찰 매달고’ 달린 운전자…도주 후엔 술,"음주 운전 이미지 [123RF] 경기 평택시에서 무면허 상태로 운전하다가 경찰에 적발되자 경찰관을 치고 도주한 40대가 붙잡혔다. 평택경찰서는 A(40대)씨를 특수공무집행방해 치상, 도로교통법 위반(무면허 운전) 혐의로... ",https://n.news.naver.com/mnews/article/016/0002463700?sid=102,,음주
