600,2025-03-24,광주시,광주시,제2순환로 학운IC 하이패스 31일 개통,광주시는 제2순환도로 본선 구간인 학운IC 요금소로부터 지산터널까지 추돌사고도 감소시켜 제2순환도로를 이용하는 시민들의 교통 편의성이 높아질 것으로 기대하고 있다. 하이패스 도입에 따른 과속 우려를 방지하기... ,http://www.kjdaily.com/article.php?aid=1742816485653033002,,과속
601,2025-03-24,광주시,광주시,광주 2순환로 학운IC 하이패스 31일 개통,"추돌사고도 감소시켜 제2순환도로를 이용하는 시민들의 교통 편의성이 한층 높아질 것으로 기대하고 있다. 광주시는 하이패스 도입에 따른 과속 우려를 방지하기 위해 지역 주민, 광주경찰청, 한국도로교통공단 등... ",http://www.bzeronews.com/news/articleView.html?idxno=703859,,과속
602,2025-03-24,광주시,광주시,"광주시 &quot;2순환로 학운IC, 차량 상습정체‧보행안전 문제 다 잡았다&quot;","추돌사고도 감소시켜 제2순환도로를 이용하는 시민들의 교통 편의성이 한층 높아질 것으로 기대하고 있다. 광주시는 하이패스 도입에 따른 과속 우려를 방지하기 위해 지역 주민, 광주경찰청, 한국도로교통공단 등... ",https://www.psnews.co.kr/news/articleView.html?idxno=2086360,,과속
603,2025-03-24,광주시,광주시,"광주시, 학운IC 하이패스 31일 개통…차량 정체 해소 및 보행자 안전 강...","교통사고가 빈번히 발생하는 등 시민 불편이 컸다. 이를 해결하기 위해 광주시는 13억 5,000만 원을 투입하여... 하이패스 진출로는 과속을 방지하기 위해 속도 제한을 30㎞/h로 설정하고, 신호과속카메라와 과속방지턱이... ",https://www.geconomy.co.kr/news/article.html?no=296221,,과속
604,2025-03-24,광주시,광주시,광주 2순환로 학운IC 하이패스 31일 개통,"추돌사고도 감소시켜 제2순환도로를 이용하는 시민들의 교통 편의성이 한층 높아질 것으로 기대하고 있다. 광주시는 하이패스 도입에 따른 과속 우려를 방지하기 위해 지역 주민, 광주경찰청, 한국도로교통공단 등... ",http://www.siminsori.com/news/articleView.html?idxno=286532,,과속
605,2025-03-24,광주시,광주시,광주 2순환로 학운IC 하이패스 31일 개통,"추돌사고도 감소시켜 제2순환도로를 이용하는 시민들의 교통 편의성이 한층 높아질 것으로 기대하고 있다. 광주시는 하이패스 도입에 따른 과속 우려를 방지하기 위해 지역 주민, 광주경찰청, 한국도로교통공단 등... ",https://daily.hankooki.com/news/articleView.html?idxno=1194752,,과속
606,2025-03-24,광주시,광주시,광주 2순환로 학운IC 하이패스 31일 개통 “차량 정체보행 문제 해결”,(사진=광주시)   차로 추가 확보해 하이패스 진출로 신설…오후2시 정식 개통 출퇴근 시간 상습 정체 해소차량 추돌사고 예방 효과 기대 보행자 안전 위해 하이패스 속도 30㎞/h 제한…과속 단속도 출퇴근길 차량 상습... ,https://www.cnbnews.com/news/article.html?no=714547,,과속
607,2025-03-24,광주시,광주시,광주 2순환로 학운IC 하이패스 31일 개통,"추돌사고가 발생하는 등 시민 불편이 컸다. 광주시는 이같한 문제를 해결하기 위해 사업비 13억5000만원을... 사진=광주광역시 광주시는 하이패스 도입에 따른 과속 우려를 방지하기 위해 지역 주민, 광주경찰청... ",https://www.pinpointnews.co.kr/news/articleView.html?idxno=330852,,과속
608,2025-03-24,광주시,광주시,"광주 제2순환도로 학운IC, 하이패스 도입…출퇴근길 정체 해소 기대","시는 하이패스 도입으로 제2순환도로 본선 학운IC 요금소에서 지산터널까지 이어지는 교통 흐름이 원활해지고, 추돌 사고 위험이 줄어들 것으로 기대하고 있다. 아울러 광주시는 하이패스 도입으로 인한 과속 우려를... ",http://www.sisafocus.co.kr/news/articleView.html?idxno=335789,,과속
609,2025-03-24,광주시,광주시,"광주광역시, 2순환로 학운IC 하이패스 개통 '눈앞'","추돌사고도 감소시켜 제2순환도로를 이용하는 시민들의 교통 편의성이 한층 높아질 것으로 기대하고 있다. 광주시는 하이패스 도입에 따른 과속 우려를 방지하기 위해 지역 주민, 광주경찰청, 한국도로교통공단 등... ",https://www.joongdo.co.kr/web/view.php?key=20250325010007408,,과속
610,2025-03-24,광주시,광주시,광주 제2순환로 학운IC 하이패스 31일 개통,추돌사고가 발생하는 등 시민들의 불편이 컸습니다. 광주시는 이같한 문제를 해결하기 위해 사업비... 광주시는 하이패스 도입에 따른 과속 우려를 방지하기 위해 하이패스 진출로 속도를 30㎞/h로 제한하고... ,https://news.bbsi.co.kr/news/articleView.html?idxno=4023045,,과속
611,2025-03-24,광주시,광주시,광주 2순환로 학운IC 하이패스 31일 개통,"추돌사고도 감소시켜 제2순환도로를 이용하는 시민들의 교통 편의성이 한층 높아질 것으로 기대하고 있다. 광주시는 하이패스 도입에 따른 과속 우려를 방지하기 위해 지역 주민, 광주경찰청, 한국도로교통공단 등... ",https://www.sentv.co.kr/article/view/sentv202503240144,,과속
612,2025-03-24,광주시,광주시,"차량 정체 ,광주 2순환로 학운IC 하이패스 31일 개통","추돌사고도 감소시켜 제2순환도로를 이용하는 시민들의 교통 편의성이 한층 높아질 것으로 기대하고 있다. 광주시는 하이패스 도입에 따른 과속 우려를 방지하기 위해 지역 주민, 광주경찰청, 한국도로교통공단 등... ",http://www.jeollailbo.com/news/articleView.html?idxno=762528,,과속
613,2025-03-24,광주시,광주시,광주 2순환로 학운IC 하이패스 31일 개통… 상습 정체 해소 기대,"학운IC 요금소부터 지산터널까지의 추돌사고 발생률도 감소할 것으로 전망된다. 광주시는 하이패스 도입으로 인한 과속 우려를 해소하고자 지역 주민, 광주경찰청, 한국도로교통공단 등과 협의해 보행자 안전대책을... ",https://www.newswhoplus.com/news/articleView.html?idxno=23362,,과속
614,2025-03-24,광주시,광주시,광주 2순환로 학운IC 하이패스 31일 개통,"추돌사고도 감소시켜 제2순환도로를 이용하는 시민들의 교통 편의성이 한층 높아질 것으로 기대하고 있다. 광주시는 하이패스 도입에 따른 과속 우려를 방지하기 위해 지역 주민, 광주경찰청, 한국도로교통공단 등... ",https://www.viva100.com/article/20250324500837,,과속
615,2025-03-24,광주시,광주시,광주 2순환로 학운IC 하이패스 차로 31일 개통,"추돌사고도 감소시켜 제2순환도로를 이용하는 시민들의 교통 편의성이 한층 높아질 것으로 기대하고 있다. 광주시는 하이패스 도입에 따른 과속 우려를 방지하기 위해 지역 주민, 광주경찰청, 한국도로교통공단 등... ",https://www.getnews.co.kr/news/articleView.html?idxno=812896,,과속
616,2025-03-24,전라남도,광양시,"정인화 광양시장, 시민 건의사항 점검하며 민생 해결 나서…현장 소통의...","앞 사고 위험 구간 개선 건의 등이다. 첫 번째로 정 시장은 옥곡면에서 제기된 도로 선형 개량 건의를... 예를 들어, 내우마을 도로는 과속 차량으로 인한 보행자 안전 우려가 제기되었고, 정 시장은 도로 제한속도 하향... ",https://www.geconomy.co.kr/news/article.html?no=296189,,과속
617,2025-03-24,광주시,광주시,"광주 제2순환도로 학운IC 하이패스 차로 신설, 차량 정체 해소 기대","추돌사고도 감소시켜 제2순환도로를 이용하는 시민들의 교통 편의성이 한층 높아질 것으로 기대하고 있다. 광주시는 하이패스 도입에 따른 과속 우려를 방지하기 위해 지역 주민, 광주경찰청, 한국도로교통공단 등... ",https://www.newscj.com/news/articleView.html?idxno=3249170,,과속
618,2025-03-24,제주도,제주시,"제주, 양방향 단속장비 도입…&quot;이륜차 안전모까지 단속&quot;","교통사고 저감 효과도 기대되고 있다. 이번 양방향 단속장비는 어린이보호구역인 제주시 보물섬학교, 한수풀어린이집 주변과 광령3리 경로당, 한림고등학교 앞 등 4곳에 설치됐다. 과속 차량과 이륜차의 안전모 위반... ",https://n.news.naver.com/mnews/article/421/0008148134?sid=102,,과속
619,2025-03-24,광주시,광주시,광주 2순환로 학운IC 하이패스 31일 개통&quot;차량 상습정체‧보행안전 문제...,"추돌사고도 감소시켜 제2순환도로를 이용하는 시민들의 교통 편의성이 한층 높아질 것으로 기대하고 있다. 광주시는 하이패스 도입에 따른 과속 우려를 방지하기 위해 지역 주민, 광주경찰청, 한국도로교통공단 등... ",https://www.dailysportshankook.co.kr/news/articleView.html?idxno=401943,,과속
620,2025-03-24,광주시,광주시,광주 2순환로 학운IC 하이패스 31일 개통,"추돌사고도 감소시켜 제2순환도로를 이용하는 시민들의 교통 편의성이 한층 높아질 것으로 기대하고 있다. 광주시는 하이패스 도입에 따른 과속 우려를 방지하기 위해 지역 주민, 광주경찰청, 한국도로교통공단 등... ",https://www.bigtanews.co.kr/article/view/big202503240011,,과속
621,2025-03-24,광주시,광주시,광주 2순환로 학운IC 하이패스 31일 ‘개통’,"추돌사고도 감소시켜 제2순환도로를 이용하는 시민들의 교통 편의성이 한층 높아질 것으로 기대하고 있다. 광주시는 하이패스 도입에 따른 과속 우려를 방지하기 위해 지역 주민, 광주경찰청, 한국도로교통공단 등... ",https://n.news.naver.com/mnews/article/081/0003527539?sid=102,,과속
622,2025-03-24,광주시,광주시,광주 2순환로 학운IC 하이패스 31일 개통 &quot;차량 상습정체‧보행안전 문...,"추돌사고도 감소시켜 제2순환도로를 이용하는 시민들의 교통 편의성이 한층 높아질 것으로 기대하고 있다. 광주시는 하이패스 도입에 따른 과속 우려를 방지하기 위해 지역 주민, 광주경찰청, 한국도로교통공단 등... ",http://www.m-i.kr/news/articleView.html?idxno=1220220,,과속
623,2025-03-24,광주시,광주시,광주 2순환로 학운IC 하이패스 31일 개통... &quot;차량 상습정체‧보행안전...,"추돌사고도 감소시켜 제2순환도로를 이용하는 시민들의 교통 편의성이 한층 높아질 것으로 기대하고 있다. 광주시는 하이패스 도입에 따른 과속 우려를 방지하기 위해 지역 주민, 광주경찰청, 한국도로교통공단 등... ",http://www.newsworker.co.kr/news/articleView.html?idxno=372374,,과속
624,2025-03-24,광주시,광주시,광주 2순환도로 학운IC 하이패스 31일 개통,"추돌사고도 감소시켜 제2순환도로를 이용하는 시민들의 교통 편의성이 한층 높아질 것으로 기대하고 있다. 광주시는 하이패스 도입에 따른 과속 우려를 방지하기 위해 지역 주민, 광주경찰청, 한국도로교통공단 등... ",http://www.jnilbo.com/76490753956,,과속
625,2025-03-24,광주시,광주시,광주 제2순환로 학운IC에 하이패스 신설...차량 정체 해소 도움,출퇴근 때는 차량 대기행렬이 진출로 구간부터 지산터널까지 이어져 추돌사고가 많이 났다. 광주시는... 광주시는 또 하이패스 진출로 속도를 30㎞/h로 제한하고 신호과속카메라와 과속방지턱을 설치한다.,https://www.ajunews.com/view/20250324104319972,,과속
626,2025-03-24,광주시,광주시,[오늘 광주] 제2순환도로 학운IC 하이패스 31일 개통,차량 대기 행렬이 지산터널까지 이어지면서 추돌사고 위험도 컸다. 이를 해결하기 위해 광주시는 총... 차량 속도는 30㎞/h로 제한되며 신호과속카메라와 과속방지턱이 설치된다. 또 보행자와 차량의 안전을 위해... ,https://n.news.naver.com/mnews/article/417/0001065750?sid=102,,과속
627,2025-03-24,광주시,광주시,광주 2순환로 학운IC 하이패스 31일 개통...속도 30㎞/h 제한·과속 단속,"추돌사고가 발생하는 등 시민 불편이 컸다. 이에 광주시는 사업비 13억5000만원을 투입해 120m 길이의... 광주시는 특히 하이패스 도입에 따른 과속 우려를 방지하기 위해 지역 주민, 광주경찰청, 한국도로교통공단 등... ",https://n.news.naver.com/mnews/article/014/0005325208?sid=102,,과속
628,2025-03-24,광주시,광주시,"광주시, 학운IC 하이패스 오는 31일 오후 2시 개통","추돌사고도 감소시켜 제2순환도로를 이용하는 시민들의 교통 편의성이 한층 높아질 것으로 기대하고 있다. 광주시는 하이패스 도입에 따른 과속 우려를 방지하기 위해 지역 주민, 광주경찰청, 한국도로교통공단 등... ",https://www.newsfreezone.co.kr/news/articleView.html?idxno=616166,,과속
629,2025-03-24,광주시,광주시,"광주시, 학운IC 하이패스 31일 개통…차량 정체 해소","기존 진출로는 현금 수납 1차로만 운영되어 출퇴근 시간대 차량정체와 추돌사고가 빈번했다. 이에 따라... 하이패스 진출로의 속도는 30㎞/h로 제한되며, 신호과속카메라와 과속방지턱이 설치된다. 보행자의 안전을... ",https://www.newspim.com/news/view/20250324000293,,과속
630,2025-03-24,광주시,광주시,광주 2순환로 학운IC 하이패스···오는 31일 개통,"추돌사고도 감소시켜 제2순환도로를 이용하는 시민들의 교통 편의성이 한층 높아질 것으로 기대하고 있다. 광주시는 하이패스 도입에 따른 과속 우려를 방지하기 위해 지역 주민, 광주경찰청, 한국도로교통공단 등... ",http://www.enewstoday.co.kr/news/articleView.html?idxno=2253601,,과속
631,2025-03-23,부산시,서구,"서구, 어린이보호구역 8곳 교통안전 시설 개선",특히 과속 단속 카메라 및 교차로 신호등 설치를 적극적으로 요청해 교통 사고 예방 효과를 극대화할 방침이다. 김이강 서구청장은 “아이들이 안전하게 학교에 다닐 수 있는 환경을 만드는 것은 우리 모두의... ,http://www.jndn.com/article.php?aid=1742724696406318068,,과속
632,2025-03-23,부산시,서구,"광주 서구, 어린이 등하굣길 안전사업 본격화",이를 위해 과속 단속카메라와 교차로 신호등 설치를 적극 요청해 교통사고 예방 효과를 극대화할 방침이다. 김이강 서구청장은 “아이들이 안전하게 학교에 다닐 수 있는 환경을 만드는 것은 우리 모두의 책임이다”며... ,http://www.jnilbo.com/76482741201,,과속
633,2025-03-23,세종시,세종시,지난해 세종시 전동 킥보드 사고 10~20대가 많았다,김전수 119종합상황실장은 &quot;전동킥보드 이용자들은 반드시 안전 장구를 착용하고 음주 운전과 과속을 자제해야 한다&quot;며 &quot;사고 발생 때는 신속하게 119에 신고해 응급 서비스를 받을 수 있도록 협조해 달라&quot;고... ,https://www.joongdo.co.kr/web/view.php?key=20250323010006873,,음주
634,2025-03-23,부산시,서구,"광주 서구, 금부초 등 어린이 등하굣길 안전사업 본격화",이를 위해 과속 단속카메라와 교차로 신호등 설치를 적극 요청해 교통사고 예방 효과를 극대화할 방침이다. 김이강 서구청장은“아이들이 안전하게 학교에 다닐 수... ,http://www.breaknews.com/1102533,,과속
635,2025-03-22,세종시,세종시,세종에서 일주일에 한 번 전동킥보드 사고 발생,"지난해 세종시에서 전동 킥보드 사고로 접수된 119 신고 건수는 56건이며, 10대와 20대 비중이 전체의 68%인 38건에 이르는 것으로 조사됐습니다. 세종소방본부는 전동 킥보드를 탈 때 반드시 안전 장구를 착용하고 과속... ",http://www.tjb.co.kr/sub0301/bodo/view/id/73269,,과속
636,2025-03-22,부산시,서구,"광주 서구, 교통안전시설 개선사업 본격 추진",이를 위해 과속 단속카메라와 교차로 신호등 설치를 적극 요청해 교통사고 예방 효과를 극대화할 방침이다. 김이강 서구청장은 &quot;아이들이 안전하게 학교에 다닐 수 있는 환경을 만드는 것은 우리 모두의 책임이다&quot;며... ,http://www.namdonews.com/news/articleView.html?idxno=813451,,과속
637,2025-03-21,부산시,서구,"광주 서구, 안전한 통학로 조성 박차…9억원 투입",과속 단속카메라와 교차로 신호등 설치를 적극 요청해 교통사고 예방 효과를 극대화할 방침이다. 김이강 서구청장은 &quot;아이들이 안전하게 학교에 다닐 수 있는 환경을 만드는 것은 우리 모두의 책임이다&quot;며 &quot;어린이보호구역... ,https://www.pointe.co.kr/news/articleView.html?idxno=40587,,과속
638,2025-03-21,부산시,서구,"광주 서구, '어린이 등하굣길 안전사업' 본격화",이를 위해 과속 단속카메라와 교차로 신호등 설치를 적극 요청해 교통사고 예방 효과를 극대화할 방침이다. 김이강 서구청장은 &quot;아이들이 안전하게 학교에 다닐 수 있는 환경을 만드는 것은 우리 모두의 책임이다&quot;며... ,http://www.newsworker.co.kr/news/articleView.html?idxno=372259,,과속
639,2025-03-21,부산시,서구,"광주광역시 서구, 어린이 등하굣길 안전사업 본격화",이를 위해 과속 단속카메라와 교차로 신호등 설치를 적극 요청해 교통사고 예방 효과를 극대화할 방침이다. 김이강 서구청장은 &quot;아이들이 안전하게 학교에 다닐 수 있는 환경을 만드는 것은 우리 모두의 책임이다&quot;며... ,http://www.iminju.net/news/articleView.html?idxno=122039,,과속
640,2025-03-21,부산시,서구,[광주 서구소식] 어린이보호구역 교통안전시설 개선 추진,경찰청 등과 협력해 사각지대 해소에 나서며 과속 단속카메라와 교차로 신호등 설치를 적극 추진해 교통사고 예방 효과를 높일 방침이다. 김이강 서구청장은 &quot;아이들이 안전하게 등하교할 수 있는 환경 조성이 최우선... ,https://n.news.naver.com/mnews/article/417/0001065444?sid=102,,과속
641,2025-03-21,부산시,서구,"서구,어린이 등하굣길 안전사업 본격화",이를 위해 과속 단속카메라와 교차로 신호등 설치를 적극 요청해 교통사고 예방 효과를 극대화할 방침이다. 김이강 광주 서구청장은 &quot;아이들이 안전하게 학교에 다닐 수 있는 환경을 만드는 것은 우리 모두의 책임이다&quot;며... ,https://www.kfenews.co.kr/news/articleView.html?idxno=632195,,과속
642,2025-03-21,부산시,서구,"광주 서구, 어린이 등하굣길 안전사업 본격화",이를 위해 과속 단속카메라와 교차로 신호등 설치를 적극 요청해 교통사고 예방 효과를 극대화할 방침이다. 김이강 서구청장은 “아이들이 안전하게 학교에 다닐 수 있는 환경을 만드는 것은 우리 모두의 책임이다”며... ,https://www.viva100.com/article/20250321500712,,과속
643,2025-03-21,부산시,서구,"광주 서구, 어린이보호구역 '교통안전시설' 개선",이를 위해 과속 단속카메라와 교차로 신호등 설치를 적극 요청해 교통사고 예방 효과를 극대화할 방침이다. 김이강 서구청장은 “아이들이 안전하게 학교에 다닐 수 있는 환경을 만드는 것은 우리 모두의 책임이다”며... ,https://n.news.naver.com/mnews/article/277/0005564932?sid=102,,과속
644,2025-03-21,부산시,서구,"광주 서구, 9억여 원 투입 어린이 등하굣길 안전사업 본격화",이를 위해 과속 단속카메라와 교차로 신호등 설치를 적극 요청해 교통사고 예방 효과를 극대화할 방침이다. 김이강 서구청장은 &quot;아이들이 안전하게 학교에 다닐 수 있는 환경을 만드는 것은 우리 모두의 책임이다&quot;며... ,http://www.enewstoday.co.kr/news/articleView.html?idxno=2252915,,과속
645,2025-03-20,충청북도,단양군,"단양군의회, 제335회 임시회 마무리… 조례안 심사 및 행정사무감사 결...","조 의원은 &quot;과속방지턱은 교통사고 예방을 위한 필수시설이지만, 시민들이 겪는 불편도 크다&quot;며 &quot;정기적인 점검과 유지보수로 안전한 도로 환경을 조성해달라&quot;고 강조했다.단양=이정학 기자 hak4829@",https://www.joongdo.co.kr/web/view.php?key=20250320010006261,,과속
646,2025-03-20,충청북도,단양군,"단양군의회 조성룡 의원, 5분 자유발언 진행","조성룡 의원은 &quot;과속방지턱은 교통사고 예방을 위한 중요 시설이지만, 일상생활 속 마주하는 불편사항 중 하나로 인적, 물적 피해예방 및 행정서비스 향상을 위해 시급히 주기적인 점검과 유지보수가 필요하다&quot;며 &quot;안전한... ",http://www.enewstoday.co.kr/news/articleView.html?idxno=2252037,,과속
647,2025-03-20,충청남도,계룡시,"계룡시, 어린이 스쿨존 사고 예방 강화… 캠페인 전개","또 어린이 보호구역 내 무인단속카메라 추가 설치, 과속방지시설 강화 등 시설 개선도 병행해 스쿨존 내 사고 발생을 원천적으로 차단할 방침이다. 이응우 계룡시장은 &quot;어린이 교통사고 예방은 운전자뿐만 아니라 지역사회... ",https://www.ccdailynews.com/news/articleView.html?idxno=2331663,,과속
648,2025-03-19,충청북도,단양군,"단양군의회 조성룡 의원, 과속방지턱 개선방안 마련 촉구","끝으로 조성룡 의원은 “과속방지턱은 교통사고 예방을 위한 중요 시설이지만, 일상생활 속 마주하는 불편사항 중 하나로 인적, 물적 피해예방 및 행정서비스 향상을... ",http://www.breaknews.com/1101685,,과속
649,2025-03-19,충청북도,단양군,조성룡·강미숙 단양군의원 '생활불편 개선 방안' 마련 촉구,조 의원은 이날 임시회 5분 자유발언에서 &quot;과속방지턱은 교통사고 예방을 위한 중요 시설이지만 일상생활 속에선 불편 사항 중 하나&quot;라며 &quot;인적·물적 피해 예방을 위해 주기적인 점검과 유지보수가 필요하다&quot;고... ,https://n.news.naver.com/mnews/article/421/0008139826?sid=102,,과속
650,2025-03-19,충청북도,단양군,과속방지턱 충격에 '척추 수술'…단양군 '관리 실태' 도마 위에,제대로 관리하지 않은 과속방지턱이 되레 교통사고 위험을 키우고 있다는 지적이 나왔다. 조성룡 단양군의원은 19일 335회 임시회 본회의 5분 자유발언에서 &quot;일부 과속방지턱이 규격보다 지나치게 높고 도색이 지워져... ,https://n.news.naver.com/mnews/article/003/0013129314?sid=102,,과속
651,2025-03-19,충청북도,단양군,"단양군의회 조성룡 의원, 5분 자유발언","조 의원은 &quot;과속방지턱은 교통사고 예방을 위한 중요 시설이지만, 일상생활 속 마주하는 불편 사항 중 하나로 인적, 물적 피해 예방 및 행정서비스 향상을 위해 시급히 주기적인 점검과 유지보수가 필요하다&quot;며 &quot;안전한... ",https://www.inews365.com/news/article.html?no=856818,,과속
652,2025-03-19,충청북도,단양군,"단양군의회 조성룡 의원, '과속방지턱 운영 관리 개선 촉구'","조성룡 의원은 &quot;과속방지턱은 교통사고 예방을 위한 중요 시설이지만, 일상생활 속 마주하는 불편사항 중 하나로 인적, 물적 피해예방 및 행정서비스 향상을 위해 시급히 주기적인 점검과 유지보수가 필요하다&quot;며 &quot;안전한... ",https://www.gukjenews.com/news/articleView.html?idxno=3227951,,과속
653,2025-03-16,부산시,서구,"페라리 중 가장 빠른 5억짜리 '812 슈퍼 패스트', 대전서 대낮에 '과속 ...","과속하던 페라리 차량, 3중 추돌 사고 일으켜대전에서 페라리 차량이 과속 운전으로 두 대의 차량을 잇달아 들이받는 사고가 일어났다.지난 15일 SBS의 보도에 따르면 사고는 이날 오후 2시 25분쯤 대전 서구 월평동의... ",https://www.insight.co.kr/news/495415,,과속
654,2025-04-24,서울시,마포구,대선 40일 앞두고… 문재인 전 대통령 ‘뇌물수수’ 기소,음주운전과 불법 숙박업 혐의로 기소된 문재인 전 대통령의 딸 다혜 씨가 17일 서울 마포구... 그는 “3년5개월간 사건을 질질 끌다가 조기 대통령선거를 40여일 앞두고 난데없이 기소한 것은 명백한 ‘정치 보복’이자... ,https://www.kyeongin.com/article/1737552,,음주
655,2025-04-06,서울시,용산구,종착점 온 문재인 前 사위 태국 취업특혜 의혹,문재인 전 대통령의 딸 다혜씨는 지난해 10월 5일 새벽 서울 용산구 이태원에서 음주운전을 하다 사고를 내... 자신과 아버지를 향한 수사가 사생활 털기이자 정치보복이라는 반발심을 드러낸 것이다. 다혜씨 가족의 태국... ,https://n.news.naver.com/mnews/article/053/0000049089?sid=102,,음주
